[
  {
    "id": "innova-aviar",
    "brand": "Innova",
    "mold": "Aviar",
    "speed": 2.0,
    "glide": 3.0,
    "turn": 0.0,
    "fade": 1.0,
    "discType": "Putter",
    "stability": "stable",
    "pdgaApproved": true,
    "yearReleased": 1985,
    "primaryStampUrl": null,
    "aliases": [
      "Aviar3"
    ],
    "schemaVersion": 1
  },
  {
    "id": "innova-destroyer",
    "brand": "Innova",
    "mold": "Destroyer",
    "speed": 12.0,
    "glide": 5.0,
    "turn": -1.0,
    "fade": 3.0,
    "discType": "Driver",
    "stability": "overstable",
    "pdgaApproved": true,
    "yearReleased": 2008,
    "primaryStampUrl": null,
    "aliases": [
      "Star Destroyer",
      "Champion Destroyer"
    ],
    "schemaVersion": 1
  },
  {
    "id": "innova-leopard",
    "brand": "Innova",
    "mold": "Leopard",
    "speed": 6.0,
    "glide": 5.0,
    "turn": -2.0,
    "fade": 1.0,
    "discType": "Fairway",
    "stability": "understable",
    "pdgaApproved": true,
    "yearReleased": 1992,
    "primaryStampUrl": null,
    "aliases": [
      "Leopard3"
    ],
    "schemaVersion": 1
  },
  {
    "id": "innova-roc",
    "brand": "Innova",
    "mold": "Roc",
    "speed": 4.0,
    "glide": 4.0,
    "turn": 0.0,
    "fade": 3.0,
    "discType": "Mid",
    "stability": "overstable",
    "pdgaApproved": true,
    "yearReleased": 1985,
    "primaryStampUrl": null,
    "aliases": [
      "Roc3",
      "Big Z Roc"
    ],
    "schemaVersion": 1
  },
  {
    "id": "innova-teebird",
    "brand": "Innova",
    "mold": "Teebird",
    "speed": 7.0,
    "glide": 5.0,
    "turn": 0.0,
    "fade": 2.0,
    "discType": "Fairway",
    "stability": "overstable",
    "pdgaApproved": true,
    "yearReleased": 1996,
    "primaryStampUrl": null,
    "aliases": [
      "Teebird3"
    ],
    "schemaVersion": 1
  },
  {
    "id": "innova-wraith",
    "brand": "Innova",
    "mold": "Wraith",
    "speed": 11.0,
    "glide": 5.0,
    "turn": -1.0,
    "fade": 3.0,
    "discType": "Driver",
    "stability": "overstable",
    "pdgaApproved": true,
    "yearReleased": 2007,
    "primaryStampUrl": null,
    "aliases": [],
    "schemaVersion": 1
  },
  {
    "id": "innova-firebird",
    "brand": "Innova",
    "mold": "Firebird",
    "speed": 9.0,
    "glide": 3.0,
    "turn": 0.0,
    "fade": 4.0,
    "discType": "Fairway",
    "stability": "overstable",
    "pdgaApproved": true,
    "yearReleased": 1999,
    "primaryStampUrl": null,
    "aliases": [],
    "schemaVersion": 1
  },
  {
    "id": "discraft-buzzz",
    "brand": "Discraft",
    "mold": "Buzzz",
    "speed": 5.0,
    "glide": 4.0,
    "turn": -1.0,
    "fade": 1.0,
    "discType": "Mid",
    "stability": "understable",
    "pdgaApproved": true,
    "yearReleased": 2003,
    "primaryStampUrl": null,
    "aliases": [],
    "schemaVersion": 1
  },
  {
    "id": "discraft-zone",
    "brand": "Discraft",
    "mold": "Zone",
    "speed": 4.0,
    "glide": 3.0,
    "turn": 0.0,
    "fade": 3.0,
    "discType": "Approach",
    "stability": "overstable",
    "pdgaApproved": true,
    "yearReleased": 2014,
    "primaryStampUrl": null,
    "aliases": [],
    "schemaVersion": 1
  },
  {
    "id": "discraft-luna",
    "brand": "Discraft",
    "mold": "Luna",
    "speed": 3.0,
    "glide": 3.0,
    "turn": 0.0,
    "fade": 3.0,
    "discType": "Putter",
    "stability": "overstable",
    "pdgaApproved": true,
    "yearReleased": 2020,
    "primaryStampUrl": null,
    "aliases": [
      "Paul McBeth Luna"
    ],
    "schemaVersion": 1
  },
  {
    "id": "discraft-undertaker",
    "brand": "Discraft",
    "mold": "Undertaker",
    "speed": 9.0,
    "glide": 5.0,
    "turn": -1.0,
    "fade": 2.0,
    "discType": "Driver",
    "stability": "stable",
    "pdgaApproved": true,
    "yearReleased": 2014,
    "primaryStampUrl": null,
    "aliases": [],
    "schemaVersion": 1
  },
  {
    "id": "discraft-thrasher",
    "brand": "Discraft",
    "mold": "Thrasher",
    "speed": 12.0,
    "glide": 5.0,
    "turn": -3.0,
    "fade": 2.0,
    "discType": "Driver",
    "stability": "understable",
    "pdgaApproved": true,
    "yearReleased": 2017,
    "primaryStampUrl": null,
    "aliases": [],
    "schemaVersion": 1
  },
  {
    "id": "mvp-tesla",
    "brand": "MVP",
    "mold": "Tesla",
    "speed": 9.0,
    "glide": 5.0,
    "turn": -1.0,
    "fade": 2.0,
    "discType": "Fairway",
    "stability": "stable",
    "pdgaApproved": true,
    "yearReleased": 2014,
    "primaryStampUrl": null,
    "aliases": [],
    "schemaVersion": 1
  },
  {
    "id": "mvp-volt",
    "brand": "MVP",
    "mold": "Volt",
    "speed": 8.0,
    "glide": 5.0,
    "turn": 0.0,
    "fade": 2.0,
    "discType": "Fairway",
    "stability": "overstable",
    "pdgaApproved": true,
    "yearReleased": 2012,
    "primaryStampUrl": null,
    "aliases": [],
    "schemaVersion": 1
  },
  {
    "id": "mvp-photon",
    "brand": "MVP",
    "mold": "Photon",
    "speed": 11.0,
    "glide": 5.0,
    "turn": -1.0,
    "fade": 2.0,
    "discType": "Driver",
    "stability": "stable",
    "pdgaApproved": true,
    "yearReleased": 2018,
    "primaryStampUrl": null,
    "aliases": [],
    "schemaVersion": 1
  },
  {
    "id": "mvp-wave",
    "brand": "MVP",
    "mold": "Wave",
    "speed": 13.0,
    "glide": 5.0,
    "turn": -2.0,
    "fade": 2.0,
    "discType": "Driver",
    "stability": "understable",
    "pdgaApproved": true,
    "yearReleased": 2017,
    "primaryStampUrl": null,
    "aliases": [],
    "schemaVersion": 1
  },
  {
    "id": "dynamic-discs-judge",
    "brand": "Dynamic Discs",
    "mold": "Judge",
    "speed": 2.0,
    "glide": 4.0,
    "turn": 0.0,
    "fade": 1.0,
    "discType": "Putter",
    "stability": "stable",
    "pdgaApproved": true,
    "yearReleased": 2013,
    "primaryStampUrl": null,
    "aliases": [
      "Emperor Judge",
      "Sockibomb Slammer"
    ],
    "schemaVersion": 1
  },
  {
    "id": "dynamic-discs-escape",
    "brand": "Dynamic Discs",
    "mold": "Escape",
    "speed": 9.0,
    "glide": 5.0,
    "turn": -1.0,
    "fade": 2.0,
    "discType": "Fairway",
    "stability": "stable",
    "pdgaApproved": true,
    "yearReleased": 2016,
    "primaryStampUrl": null,
    "aliases": [],
    "schemaVersion": 1
  },
  {
    "id": "dynamic-discs-trespass",
    "brand": "Dynamic Discs",
    "mold": "Trespass",
    "speed": 12.0,
    "glide": 5.0,
    "turn": -0.5,
    "fade": 3.0,
    "discType": "Driver",
    "stability": "overstable",
    "pdgaApproved": true,
    "yearReleased": 2014,
    "primaryStampUrl": null,
    "aliases": [],
    "schemaVersion": 1
  },
  {
    "id": "latitude-64-pure",
    "brand": "Latitude 64",
    "mold": "Pure",
    "speed": 3.0,
    "glide": 3.0,
    "turn": -1.0,
    "fade": 1.0,
    "discType": "Putter",
    "stability": "understable",
    "pdgaApproved": true,
    "yearReleased": 2013,
    "primaryStampUrl": null,
    "aliases": [],
    "schemaVersion": 1
  },
  {
    "id": "latitude-64-river",
    "brand": "Latitude 64",
    "mold": "River",
    "speed": 7.0,
    "glide": 7.0,
    "turn": -1.0,
    "fade": 1.0,
    "discType": "Fairway",
    "stability": "understable",
    "pdgaApproved": true,
    "yearReleased": 2013,
    "primaryStampUrl": null,
    "aliases": [],
    "schemaVersion": 1
  },
  {
    "id": "latitude-64-saint",
    "brand": "Latitude 64",
    "mold": "Saint",
    "speed": 8.0,
    "glide": 5.0,
    "turn": -1.0,
    "fade": 2.0,
    "discType": "Fairway",
    "stability": "stable",
    "pdgaApproved": true,
    "yearReleased": 2012,
    "primaryStampUrl": null,
    "aliases": [],
    "schemaVersion": 1
  },
  {
    "id": "discmania-fd",
    "brand": "Discmania",
    "mold": "FD",
    "speed": 7.0,
    "glide": 6.0,
    "turn": -1.0,
    "fade": 1.0,
    "discType": "Fairway",
    "stability": "understable",
    "pdgaApproved": true,
    "yearReleased": 2009,
    "primaryStampUrl": null,
    "aliases": [
      "Jackal"
    ],
    "schemaVersion": 1
  },
  {
    "id": "discmania-md3",
    "brand": "Discmania",
    "mold": "MD3",
    "speed": 5.0,
    "glide": 5.0,
    "turn": 0.0,
    "fade": 2.0,
    "discType": "Mid",
    "stability": "overstable",
    "pdgaApproved": true,
    "yearReleased": 2010,
    "primaryStampUrl": null,
    "aliases": [],
    "schemaVersion": 1
  },
  {
    "id": "discmania-p2",
    "brand": "Discmania",
    "mold": "P2",
    "speed": 2.0,
    "glide": 3.0,
    "turn": 0.0,
    "fade": 1.0,
    "discType": "Putter",
    "stability": "stable",
    "pdgaApproved": true,
    "yearReleased": 2010,
    "primaryStampUrl": null,
    "aliases": [],
    "schemaVersion": 1
  },
  {
    "id": "prodigy-h3-v2",
    "brand": "Prodigy",
    "mold": "H3 V2",
    "speed": 7.0,
    "glide": 5.0,
    "turn": 0.0,
    "fade": 2.0,
    "discType": "Fairway",
    "stability": "overstable",
    "pdgaApproved": true,
    "yearReleased": 2017,
    "primaryStampUrl": null,
    "aliases": [],
    "schemaVersion": 1
  },
  {
    "id": "prodigy-d2",
    "brand": "Prodigy",
    "mold": "D2",
    "speed": 12.0,
    "glide": 6.0,
    "turn": -1.0,
    "fade": 3.0,
    "discType": "Driver",
    "stability": "overstable",
    "pdgaApproved": true,
    "yearReleased": 2013,
    "primaryStampUrl": null,
    "aliases": [],
    "schemaVersion": 1
  },
  {
    "id": "prodigy-pa-3",
    "brand": "Prodigy",
    "mold": "PA-3",
    "speed": 3.0,
    "glide": 4.0,
    "turn": 0.0,
    "fade": 1.0,
    "discType": "Putter",
    "stability": "stable",
    "pdgaApproved": true,
    "yearReleased": 2013,
    "primaryStampUrl": null,
    "aliases": [],
    "schemaVersion": 1
  },
  {
    "id": "westside-harp",
    "brand": "Westside",
    "mold": "Harp",
    "speed": 4.0,
    "glide": 3.0,
    "turn": 0.0,
    "fade": 3.0,
    "discType": "Approach",
    "stability": "overstable",
    "pdgaApproved": true,
    "yearReleased": 2014,
    "primaryStampUrl": null,
    "aliases": [],
    "schemaVersion": 1
  },
  {
    "id": "westside-king",
    "brand": "Westside",
    "mold": "King",